{
  "contract_version": "diagram-manifest/1.0.0",
  "renderer": {
    "name": "pele",
    "version": "1.6.0"
  },
  "theme": {
    "preset": "paper",
    "variables": {}
  },
  "diagrams": [
    {
      "asset_id": "asset-example-flow",
      "page_number": 1,
      "intent": "这一页要说清的因果链（一句话，给审阅的人看）",
      "syntax": "mermaid",
      "source": "flowchart TD\n  A[起点] --> B[所以] --> C[结论]",
      "output": "../diagrams/asset-example-flow.svg",
      "rendered_sha256": "0000000000000000000000000000000000000000000000000000000000000000",
      "options": {
        "max_width": 560
      },
      "visual_check": {
        "status": "pending",
        "method": "",
        "notes": ""
      }
    }
  ]
}
